[
  {
    "id": "R1",
    "name": "Catalytic hydrogenation (H₂, Pt)",
    "chapter": 16,
    "section": "alcohols",
    "phase": 1,
    "reagentsText": "H₂, Pt (or Pd, Ni)",
    "steps": [
      {
        "reagents": [
          "H2_Pt"
        ]
      }
    ],
    "rules": {
      "summary": "Reduces C=O (aldehyde/ketone) → alcohol AND C=C → C–C.",
      "notes": [
        "Esters, acids and benzene rings survive."
      ]
    },
    "stereoOutcome": "racemic_if_new_center",
    "typicalTags": [
      "stopped_halfway",
      "reagent_label_unknown"
    ],
    "decoys": [
      "NaBH4",
      "LiAlH4"
    ]
  },
  {
    "id": "R2",
    "name": "NaBH₄ reduction",
    "chapter": 16,
    "section": "alcohols",
    "phase": 1,
    "reagentsText": "NaBH₄, MeOH/EtOH",
    "steps": [
      {
        "reagents": [
          "NaBH4"
        ]
      }
    ],
    "rules": {
      "summary": "Aldehyde → 1° alcohol, ketone → 2° alcohol. Leaves C=C, esters and COOH alone."
    },
    "stereoOutcome": "racemic_if_new_center",
    "typicalTags": [
      "over_reduction",
      "missing_stereo"
    ],
    "decoys": [
      "LiAlH4",
      "H2_Pt"
    ]
  },
  {
    "id": "R3",
    "name": "LiAlH₄ reduction of aldehydes and ketones",
    "chapter": 16,
    "section": "alcohols",
    "phase": 1,
    "reagentsText": "1. LiAlH₄, ether/THF; 2. H₂O",
    "steps": [
      {
        "reagents": [
          "LiAlH4"
        ]
      },
      {
        "reagents": [
          "H2O"
        ],
        "conditions": {
          "temp": "rt"
        }
      }
    ],
    "rules": {
      "summary": "Aldehyde/ketone → alkoxide, then H₂O → alcohol.",
      "notes": [
        "The workup is its own step."
      ]
    },
    "stereoOutcome": "racemic_if_new_center",
    "typicalTags": [
      "missing_workup",
      "wrong_reagent_order"
    ],
    "decoys": [
      "PCC",
      "H2CrO4"
    ]
  },
  {
    "id": "R4",
    "name": "LiAlH₄ reduction of a carboxylic acid",
    "chapter": 16,
    "section": "alcohols",
    "phase": 1,
    "reagentsText": "1. LiAlH₄, ether/THF; 2. H₂O",
    "steps": [
      {
        "reagents": [
          "LiAlH4"
        ]
      },
      {
        "reagents": [
          "H2O"
        ],
        "conditions": {
          "temp": "rt"
        }
      }
    ],
    "rules": {
      "summary": "RCOOH → RCH₂OH (1° alcohol). Does not stop at the aldehyde.",
      "notes": [
        "Only LiAlH₄ does this."
      ]
    },
    "stereoOutcome": "none",
    "typicalTags": [
      "stopped_halfway",
      "missing_workup"
    ],
    "decoys": [
      "NaBH4",
      "H2_Pt"
    ]
  },
  {
    "id": "R5",
    "name": "LiAlH₄ reduction of an ester",
    "chapter": 16,
    "section": "alcohols",
    "phase": 1,
    "reagentsText": "1. LiAlH₄, ether/THF; 2. H₂O",
    "steps": [
      {
        "reagents": [
          "LiAlH4"
        ]
      },
      {
        "reagents": [
          "H2O"
        ],
        "conditions": {
          "temp": "rt"
        }
      }
    ],
    "rules": {
      "summary": "Ester → TWO alcohols: acyl side → RCH₂OH, alkoxy side → R′OH.",
      "notes": [
        "A lactone gives one diol."
      ]
    },
    "stereoOutcome": "none",
    "typicalTags": [
      "ester_one_piece",
      "stopped_halfway",
      "missing_workup"
    ],
    "decoys": [
      "NaBH4",
      "H2_Pt"
    ]
  },
  {
    "id": "R6",
    "name": "Grignard + formaldehyde",
    "chapter": 16,
    "section": "alcohols",
    "phase": 2,
    "reagentsText": "1. Mg, ether; 2. HCHO; 3. H₃O⁺",
    "steps": [
      {
        "reagents": [
          "Mg_ether"
        ]
      },
      {
        "reagents": [
          "HCHO"
        ]
      },
      {
        "reagents": [
          "H3O_plus"
        ]
      }
    ],
    "rules": {
      "summary": "R–X → R–MgBr; adds to HCHO → 1° alcohol with one extra carbon.",
      "notes": [
        "Any acidic H (OH, SH, NH) kills the Grignard.",
        "H₃O⁺ workup is its own step."
      ]
    },
    "stereoOutcome": "none",
    "typicalTags": [
      "missing_workup",
      "wrong_reagent_order"
    ]
  },
  {
    "id": "R7",
    "name": "Grignard + aldehyde",
    "chapter": 16,
    "section": "alcohols",
    "phase": 2,
    "reagentsText": "1. Mg, ether; 2. RCHO; 3. H₃O⁺",
    "steps": [
      {
        "reagents": [
          "Mg_ether"
        ]
      },
      {
        "reagents": [
          "CH3CHO"
        ]
      },
      {
        "reagents": [
          "H3O_plus"
        ]
      }
    ],
    "rules": {
      "summary": "R–MgBr adds to an aldehyde → 2° alcohol."
    },
    "stereoOutcome": "racemic_if_new_center",
    "typicalTags": [
      "missing_workup",
      "missing_stereo"
    ]
  },
  {
    "id": "R8",
    "name": "Grignard + ketone",
    "chapter": 16,
    "section": "alcohols",
    "phase": 2,
    "reagentsText": "1. Mg, ether; 2. R₂C=O; 3. H₃O⁺",
    "steps": [
      {
        "reagents": [
          "Mg_ether"
        ]
      },
      {
        "reagents": [
          "acetone"
        ]
      },
      {
        "reagents": [
          "H3O_plus"
        ]
      }
    ],
    "rules": {
      "summary": "R–MgBr adds to a ketone → 3° alcohol."
    },
    "stereoOutcome": "none",
    "typicalTags": [
      "missing_workup"
    ]
  },
  {
    "id": "R9",
    "name": "Grignard + ethylene oxide",
    "chapter": 16,
    "section": "alcohols",
    "phase": 2,
    "reagentsText": "1. Mg, ether; 2. ethylene oxide; 3. H₃O⁺",
    "steps": [
      {
        "reagents": [
          "Mg_ether"
        ]
      },
      {
        "reagents": [
          "ethylene_oxide"
        ]
      },
      {
        "reagents": [
          "H3O_plus"
        ]
      }
    ],
    "rules": {
      "summary": "R–MgBr opens ethylene oxide → 1° alcohol with two extra carbons."
    },
    "stereoOutcome": "none",
    "typicalTags": [
      "missing_workup"
    ]
  },
  {
    "id": "R10",
    "name": "Hydroboration–oxidation",
    "chapter": 16,
    "section": "alcohols",
    "phase": 1,
    "reagentsText": "1. BH₃·THF; 2. H₂O₂, NaOH",
    "steps": [
      {
        "reagents": [
          "BH3_THF"
        ]
      },
      {
        "reagents": [
          "H2O2_NaOH"
        ]
      }
    ],
    "rules": {
      "summary": "Anti-Markovnikov hydration: OH on the less substituted carbon, H and OH syn. New stereocenters → racemic.",
      "regio": "OH goes to the carbon with more hydrogens.",
      "stereo": "Syn addition: on a ring the OH is trans to the substituent that was on the other alkene carbon."
    },
    "stereoOutcome": "syn_racemic",
    "typicalTags": [
      "markovnikov_flip",
      "missing_stereo",
      "syn_anti_mixup",
      "missing_workup"
    ],
    "decoys": [
      "H3O_plus",
      "OsO4"
    ]
  },
  {
    "id": "R11",
    "name": "Syn dihydroxylation (OsO₄)",
    "chapter": 16,
    "section": "alcohols",
    "phase": 1,
    "reagentsText": "OsO₄ (then NaHSO₃/H₂O, or cat. OsO₄ + NMO)",
    "steps": [
      {
        "reagents": [
          "OsO4"
        ]
      }
    ],
    "rules": {
      "summary": "Syn diol. Symmetric cis-alkene → meso; trans → racemic; chiral cis diols → racemic. Not cleavage (that is O₃)."
    },
    "stereoOutcome": "syn_meso_or_racemic",
    "typicalTags": [
      "ozone_vs_osmium",
      "meso_vs_racemic",
      "missing_stereo"
    ],
    "decoys": [
      "O3",
      "KMnO4",
      "mCPBA"
    ]
  },
  {
    "id": "R12",
    "name": "SOCl₂ chlorination",
    "chapter": 16,
    "section": "alcohols",
    "phase": 2,
    "reagentsText": "SOCl₂, pyridine",
    "steps": [
      {
        "reagents": [
          "SOCl2"
        ]
      }
    ],
    "rules": {
      "summary": "ROH → RCl."
    },
    "stereoOutcome": "none",
    "typicalTags": [
      "reagent_label_unknown"
    ]
  },
  {
    "id": "R13",
    "name": "PBr₃ bromination",
    "chapter": 16,
    "section": "alcohols",
    "phase": 2,
    "reagentsText": "PBr₃",
    "steps": [
      {
        "reagents": [
          "PBr3"
        ]
      }
    ],
    "rules": {
      "summary": "1°/2° ROH → RBr (SN2, no rearrangement).",
      "notes": [
        "3° alcohols: use HBr instead."
      ]
    },
    "stereoOutcome": "none",
    "typicalTags": [
      "reagent_label_unknown"
    ]
  },
  {
    "id": "R14",
    "name": "HX on alcohols",
    "chapter": 16,
    "section": "alcohols",
    "phase": 2,
    "reagentsText": "HX",
    "steps": [
      {
        "reagents": [
          "HBr"
        ],
        "conditions": {
          "temp": "rt",
          "light": false
        }
      }
    ],
    "rules": {
      "summary": "3° ROH reacts fast (SN1); 1° with HBr (SN2); HCl needs ZnCl₂ for 1°/2°."
    },
    "stereoOutcome": "none",
    "typicalTags": [
      "reagent_label_unknown",
      "wrong_temperature"
    ],
    "decoys": [
      "NBS"
    ]
  },
  {
    "id": "R15",
    "name": "Acid-catalysed dehydration",
    "chapter": 16,
    "section": "alcohols",
    "phase": 2,
    "reagentsText": "H₂SO₄ (or H₃PO₄), heat",
    "steps": [
      {
        "reagents": [
          "H2SO4_heat"
        ],
        "conditions": {
          "temp": "reflux"
        }
      }
    ],
    "rules": {
      "summary": "E1 dehydration, Zaitsev major; 1° alcohols only at ~180 °C.",
      "regio": "Zaitsev: the more substituted alkene."
    },
    "stereoOutcome": "none",
    "typicalTags": [
      "zaitsev_flip",
      "wrong_temperature"
    ],
    "decoys": [
      "H2CrO4",
      "PCC"
    ]
  },
  {
    "id": "R16",
    "name": "Symmetric ether from two 1° alcohols",
    "chapter": 16,
    "section": "alcohols",
    "phase": 2,
    "reagentsText": "H₂SO₄, 140 °C",
    "steps": [
      {
        "reagents": [
          "H2SO4_heat"
        ],
        "conditions": {
          "temp": "c140"
        }
      }
    ],
    "rules": {
      "summary": "Two 1° alcohols condense (SN2) to the symmetric ether at 140 °C; 180 °C gives the alkene instead."
    },
    "stereoOutcome": "none",
    "typicalTags": [